{
  "version": 5,
  "profile": "local-session-trace-v5",
  "historyVersion": 5,
  "contentPolicy": "public-v1",
  "allowedSessions": "current-task-plus-explicit-terminal-closed-v5",
  "boundary": "pre-step-or-scoped-admission",
  "capabilities": [
    "session_event_read",
    "session_search",
    "session_trace"
  ],
  "maxInputBytes": 4096,
  "maxJsonDepth": 4,
  "maxWindowSide": 4,
  "maxNeighbors": 8,
  "maxEventBytes": 16384,
  "maxEvents": 128,
  "maxSummaryCodePoints": 256,
  "maxSummaryTextBytes": 1024,
  "maxSummaryJsonBytes": 1536,
  "maxOutputBytes": 32768,
  "maxReadRows": 9,
  "maxReadScratchBytes": 1048576,
  "maxContextBytes": 4096,
  "maxRecent": 8,
  "timeoutMs": 2000,
  "lockWaitSeconds": 1,
  "maxModelRequestBytes": 65536,
  "maxCheckpointBytes": 131072,
  "maxModelResponseBytes": 16384,
  "maxCallsPerResponse": 4,
  "maxModelRequests": 8,
  "maxToolInvocations": 20,
  "maxAttempts": 8,
  "maxReliableEvents": 256,
  "maxSummaryBytes": 8192,
  "maxDatabaseBodyBytes": 7340032,
  "maxMetadataBytes": 65536,
  "reservedTaskBytes": 8388608,
  "retentionSeconds": 604800,
  "catalogDigest": "c5e41af8f9ff746ade078feaecd5fdad245188829c65e595dc4c0c49dc846a29",
  "eventVersion": 5,
  "maxReadInputBytes": 1024,
  "maxNormalizedQueryBytes": 4096,
  "maxQueryCodePoints": 256,
  "maxQueryBytes": 1024,
  "matchPolicy": "public-content-literal-v1",
  "ordering": "occurrences-desc,length-asc,time-desc,session-id-asc,seq-desc",
  "maxSearchRows": 1024,
  "maxSearchEventBytes": 4194304,
  "maxSearchReadBytes": 16777216,
  "maxSearchScratchBytes": 16777216,
  "maxSearchSourceReads": 4096,
  "maxSearchComparisons": 16777216,
  "maxSearchResults": 4,
  "maxSnippetCodePoints": 240,
  "maxSnippetTextBytes": 960,
  "maxSnippetJsonBytes": 1536,
  "maxSearchHitBytes": 2048,
  "maxReadSourceSnapshotBytes": 2048,
  "maxSearchOutputBytes": 16384,
  "maxSearchOperations": 2097152,
  "maxScopeTargets": 8,
  "maxScopeBytes": 4096,
  "authorityVersion": 1,
  "authorityPolicy": "explicit-terminal-closed-v5",
  "retentionPolicy": "earliest-source-or-caller-seven-days",
  "maxDeadlineSeconds": 180,
  "lineagePolicy": "owner-declared-continuation-v1",
  "coverage": "admission-scope",
  "maxLineageNodes": 9,
  "maxLineageEdges": 8,
  "maxLineageDepth": 8,
  "maxLineageProofReads": 256,
  "maxLineageProofBytes": 1048576,
  "maxLineageScratchBytes": 1048576,
  "maxLineageOperations": 65536,
  "maxLineageOutputBytes": 8192,
  "maxGenesisBytes": 1024,
  "maxGraphBytes": 16384
}
